{
  "kind": "fl-sap-receipt",
  "version": 1,
  "orderGuid": "6f1c2a9e-4b7d-4e2a-9c1f-2d8e5a3b7c40",
  "orderFile": "FL-000012_20261003-081500.json",
  "requestSpId": 12,
  "requestNo": "FL-000012",
  "state": "Created",
  "sapSystem": "GQ1",
  "sapClient": "450",
  "lockedBy": "EKSEM",
  "lockedOn": "2026-10-03T10:31:02",
  "updatedOn": "2026-10-03T10:34:47",
  "finishedOn": "2026-10-03T10:34:47",
  "rows": [
    {
      "spId": 101,
      "rowNo": 1,
      "functionalLocation": "SSV10 LAC10AB001 -B01",
      "done": true,
      "result": "Created",
      "sapMessage": "Functional location SSV10 LAC10AB001 -B01 created",
      "lastError": null
    },
    {
      "spId": 102,
      "rowNo": 2,
      "functionalLocation": "SSV10 LAC10AP001 -M01",
      "done": true,
      "result": "Updated",
      "sapMessage": "Changes to functional location SSV10 LAC10AP001 -M01 saved",
      "lastError": null
    },
    {
      "spId": 103,
      "rowNo": 3,
      "functionalLocation": "SSV10 BFA01GH001 -W01",
      "done": true,
      "result": "Created",
      "sapMessage": "Functional location SSV10 BFA01GH001 -W01 created",
      "lastError": null
    }
  ],
  "warnings": [
    "SSV10 LAC10AB001 -B01: karakteristikken 'Owner' blev ikke fundet paa skaermen og er ikke skrevet."
  ],
  "lastError": null,
  "log": [
    { "at": "2026-10-03T10:31:02", "text": "Start (GQ1/450, EKSEM)" },
    { "at": "2026-10-03T10:32:10", "text": "SSV10 LAC10AB001 -B01: oprettet" },
    { "at": "2026-10-03T10:33:29", "text": "SSV10 LAC10AP001 -M01: fandtes, aendret" },
    { "at": "2026-10-03T10:34:47", "text": "SSV10 BFA01GH001 -W01: oprettet" }
  ]
}
